"id","content"
"1gmkv33","Gluing proteins together kills cancer super selectively | Scientists have demonstrated a creative new way to kill cancer cells effectively, with few side effects. Gluing two particular proteins together tricks the tumors into destroying themselves."
"1gmyyn9","AI helps robot dogs navigate the real world | Four-legged robot dogs learned to perform new tricks by practising in a virtual platform that mimics real-world obstacles – a possible shortcut for training robots faster and more accurately"
"1gnd9hh","Waste oil turned into biodiesel in just 60 minutes, can power all types of vehicles | Chemists have also claimed that the reaction can be completed in under an hour at a temperature lower than that required to boil water."
"1gnpd51","US firm sets fusion plasma temperature record at 392 million degrees F"
"1go0xuj","LG's EV battery with six times more energy to power Rivian R2"
"1go1r0p","Next-gen transparent semiconductor material could make electronics efficient, faster | The entirely synthetic material is both transparent and highly conductive, making it ideal for high-power electronics."
"1go2egw","Groundbreaking laser tech enables faster, safer landmine detection"
"1gosc0p","New stellarator design to boost fusion research, stays on all the time"
"1goupx8","Students’ unique humanoid robot achieves real-time human mimicry, teleoperation | The robot’s inverse kinematics system allows it to replicate human motions, improving its responsive and adaptive interaction with the environment."
"1gpi588","Carpet waste makes concrete crack-proof, boosts strength by 40% — Aussie engineers | The new technique significantly reduced early-age concrete cracking by up to 30%."
"1gpjcqw","Breakthrough robot nails surgery like a human doctor after watching videos | The model can quickly train robots for diverse surgeries, from basic tasks to full procedures, advancing robotic medical capabilities."
"1gpkd1k","Super-strong magnetic muscles lift 1,000 times their weight with ease"
"1gqca2j","Superhuman vision lets robots see through walls, smoke with new LiDAR-like eyes | AI-powered PanoRadar turns radio waves into 3D views, offering robots LiDAR-like vision at lower cost."
"1gqdgbq","Torso: New creepy humanoid robot with water-powered muscles unveiled | The humanoid’s hydraulic system pumps water to achieve the flex to activate its artificial muscles."
"1gqdnyv","Beetle-inspired robots roll objects with new neural control system"
"1gr3dkv","Fatbergs fighter: New self-healing zinc coating cuts sewer clogging by 30% | In lab tests, the coated concrete showed a 30% reduction in fat, oil, and grease buildup."
"1gr5pai","New microreactor converts CO2 to methanol with renewable energy"
"1grv3rt","Finland’s 100MW sand battery turns 2,000 tons of fireplace waste into power | In terms of size, this unique battery will have a height of about 13 meters and a width of roughly 15 meters."
"1grwr8n","Wave-busting tech from Edinburgh keeps robots steady in stormy waters"
"1gsnsd2","Electro-biodiesel: Scientists make 45x more efficient fuel from CO2"
"1gte1hg","ITER receives Hyundai-made vacuum vessel to house nuclear reactions"
"1gti13c","Scientists Make First Mechanical Qubit"
"1gu4lnm","China’s 3 GW solar plant with nearly 6,000,000 panels to power millions of homes | With nearly 6 million panels, the project will prevent release of 4.7 million tons of CO2 every year."
"1gu5599","Robot dog BERT moves faster using new energy-efficient movement tech"
"1gudeus","Revolutionary membrane tech separates 97% oil from water with 99.9% purity | Researchers in China have unveiled a new, highly effective technique for separating oil and water mixtures."
"1guwcq8","Tethered robots could turn Moon’s lava tubes into future astronaut homes | The researchers put this system to the test in the harsh volcanic landscapes of Lanzarote Island in the Atlantic Ocean."
"1guxo1z","MIT spinout uses engines to turn trash gas into green fuel factories"
"1guz7z1","422-million-year-old ancient animal cell helps scientists create a mouse | The team uncovered that choanoflagellates possess versions of the Sox and POU genes—key drivers of pluripotency."
"1gv7sdh","Niantic uses Pokémon Go player data to build AI navigation system. Visual scans of the world have helped Niantic build what it calls a ""Large Geospatial Model."""
"1gve1wk","Scientists identify tomato genes to tweak for sweeter fruit"
"1gvnw6q","New 3D Bioprinter Could Build Replicas of Human Organs, Offering a Boost for Drug Discovery | The invention uses light, sound and bubbles to quickly create copies of soft tissue that might one day support testing individualized therapies for cancer and other diseases"
"1gvpxi0","UK scientists extend solar cell life by stunning 66%, boost efficiency by 23% | To enhance the performance of lead-tin perovskite cells, the team investigated the role of the hole transport layer, a crucial component in solar cell function."
"1gvq5j4","Princeton achieves 10x reduction in tritium needs for nuclear fusion"
"1gvqhog","Microsoft and Atom Computing combine for quantum error correction demo"
"1gwek8q","No more injections: MIT develop capsule that delivers drugs straight to the gut | This capsule is designed to release drugs directly into the stomach wall or other organs in the digestive tract."
"1gwgrar","Space-Age material to boost next-gen modular nuclear fusion reactors"
"1gwia4j","Chemists Use Light To Break Down PFAS at Room Temperature | Chemists have illustrated how an LED light-based photocatalytic system can break the carbon-fluorine bonds in PFAS."
"1gx581m","US deploys first-ever autonomous robotic cameras in stratosphere nationwide | The Swift robots offer enhanced resolution capabilities of 7 centimeters, which match or surpass traditional aerial survey quality."
"1gx7iyv","Bite of hope: Malaria vaccine delivered by gene-edited mosquito kills infection by 89% | This technique gave the immune system a powerful boost, shielding people from the disease."
"1gx8c5v","New solar cell coating triples efficiency, stability, conversion rate"
"1gxmqb6","US deploys first-ever autonomous robotic cameras in stratosphere nationwide"
"1gxy33o","This New, Yellow Powder Quickly Pulls Carbon Dioxide From the Air. Scientists say just 200 grams of the porous material, known as a covalent organic framework, is called COF-999, could capture 44 pounds of the greenhouse gas per year—the same as a large tree"
"1gxzucv","New heat-to-electricity tech beats battery storage with 60% efficiency"
"1gyr6gl","""... jet engines shouldn’t be possible"" “The air coming in is hotter than the melting point of the metal underneath... To get around this problem heat-resistant ceramic coatings are applied to the engine blades. Now researchers are developing stronger coatings allowing the engines to run even hotter"
"1gyukb6","A reaction that only measured protons detected neutrons for the first time | For the last 10 years, scientists have been working on a neutron detector. Finally, they tested it, and it worked like magic."
"1gzh4xb","Engineers turn rotten seaweed into car fuel, aim to cut 14 million-ton of CO2 | Seaweed is showing up on Caribbean beaches and cleaning up costs are in millions of dollars. But this waste can be turned into precious fuels."
"1gzjrst","Boom Supersonic XB-1 jet hits 25,040 feet in record-setting flight"
"1h0c9tj","To design better water filters, MIT engineers look to manta rays. New research shows the filter-feeders strike a natural balance between permeability and selectivity that could inform design of water treatment systems."
"1h0cre8","Scientists use sunlight to break the toughest plastic to recycle"
"1h12sn1","Researchers develop rare earth-free high power electric motors using copper | Using copper coils instead of rare Earth materials in the motor’s rotating part is much more accessible."
"1h14xgc","Japan’s superalloys withstand 1112°F test to protect nuclear fusion reactors "
"1h1u9dd","Gold-based drug slows cancer tumor growth by 82%, outperforms chemotherapy | Gold’s unique properties make it ideal for medical applications, as it is highly stable and unreactive, which also explains its common use in jewelry and coins."
"1h1w4xn","Robot balloons soar 85,000 ft, map NYC-sized areas with 0 emissions"
"1h2mxra","Korea’s artificial Sun switched on to target tungsten impurities"
"1h3dnxy","UK unveils world's 1st AI-designed urban wind turbine with 7x efficiency"
"1h444kn","World first: Scientists convert heat into electricity using tungsten disilicide"
"1h4ujrh","Plasma compression breakthrough: General Fusion hits 600 million neutrons per second | General Fusion demonstrated the viability of a stable fusion process using its MTF approach."
"1h4vl96","Scientists make wood glow with 2,400-year-old honey fungus in a scientific adventure | The biohybrid of fungus and wood, developed in the lab, produces green light after being incubated for three months, with plans to increase its luminosity further."
"1h4vn07","World’s largest CO2 heat pump with 70MW capacity begins operation to power 25,000 homes"
"1h4zvjw","InterestingEngineering has been banned"
"1h5ng2l","AI Dash Cams Give Wake-Up Calls to Drowsy Drivers | Innovative tech detects driver fatigue and signals them to take a break"
"1h5qkfp","Electronic ‘tattoos’ offer an alternative to electrodes for brain monitoring | A spray-on ink detects electrical activity in the brain for hours"
"1h66avu","Licking this “lollipop” will let you taste virtual flavors"
"1h6fl9r","A new catalyst can turn methane into something useful. MIT chemical engineers have devised a way to capture methane, a potent greenhouse gas, and convert it into polymers."
"1h6gurk","Refurbished heart pacemakers work like new"
"1h6y0td","Robot cat that sticks landing may revolutionise asteroid mining, scientists say"
"1h78m56","Prenatal test accidentally picks up cancer in 50% of those with wonky results | The prenatal test results flagged cancers when other screens and tests missed it."
"1h78or2","Billions of people to benefit from technology breakthrough that ensures freshwater for the world"
"1h792n3","Carpet fibres stop concrete cracking. Engineers in Australia have found a way to make stronger and crack-resistant concrete with scrap carpet fibres, rolling out the red carpet for sustainability in the construction sector."
"1h7qdkm","'Breakthrough' dementia drug looks to stop disease in its tracks"
"1h8130c","Two European satellites launch on mission to blot out the Sun—for science"
"1h815us","Burned rice hulls could help batteries store more charge"
"1h8350t","Scientists develop battery with 5,000+ year lifespan by encasing radioactive carbon in diamond | It could power electronics aboard space probes for centuries, among other things"
"1h8fwm0","Virtual lab powered by ‘AI scientists’ super-charges biomedical research"
"1h8s83b","Researchers claim record-breaking 25.7% efficency for perovskite-organic tandem solar cell"
"1h8tarx","Drones With Legs Can Walk, Hop, and Jump Into the Air"
"1h98sb7","The Art of Failure Analysis. Searching for defects in their chips, these engineers found something inspiring."
"1h9jtac","""World's simplest"" nuclear reactors could be installed underground to provide heat to cities"
"1h9jyfw","Temporary scalp e-tattoos that scan brain could replace traditional EEGs forever"
"1h9p8h3","Scientists discover new way to make fuel from water and sunlight, but more work is needed"
"1ha8fsu","Brain Stimulation Helps People ​Walk After Spinal Injury | Researchers created a ""brain atlas"" to find the right spot for electrodes"
"1ha9xig","Crop Parasites Can Be Deterred by “Electric Fences” A pesticide-free technique holds promise by scrambling protists’ senses"
"1hb24op","Sionic Energy Unveils 100-Percent Silicon Anode Battery"
"1hbirv1","Ferroelectric Devices Could Make IoT Data Unhackable. FeFET array enables homomorphic encryption in battery-powered devices."
"1hbnqfg","Nvidia, Rigetti, Quantum Machines Deliver AI-Powered Quantum Computing"
"1hbtd03","AI Is Driving India’s Next Agricultural Revolution"
"1hbuf8o","Google gets an error-corrected quantum bit to be stable for an hour"
"1hbug93","Transforming fusion from a scientific curiosity into a powerful clean energy source"
"1hcj85x","Fish-Inspired Sensor ""Touches"" Using Electric Fields | A synthetic e-skin uses capacitance to detect nearby objects"
"1hcl9co","Graphene Interconnects to Moore's Law's Rescue"
"1hclrpw","Scientists have accidentally discovered a particle that has mass when it’s traveling in one direction, but no mass while traveling in a different direction | Known as semi-Dirac fermions, particles with this bizarre behavior were first predicted 16 years ago."
"1hdai04","New tongue-stimulating implant offers hope to millions with sleep apnoea in UK first | Nyxoah’s Genio device zaps the nerves in the tongue to help sufferers breathe better overnight"
"1hdco1q","Award-winning tech uses cyborg mollusks to monitor water pollution"
"1hdnl19","Nvidia, AMD, and Intel invest in Ayar Labs to enable futuristic light-based chips"
"1he2dzd","New invention harvests static energy from waste polystyrene to produce electricity"
"1he3w1t","Noninvasive imaging method can penetrate deeper into living tissue. Using high-powered lasers, this new method could help biologists study the body’s immune responses and develop new medicines."
"1he6r00","New retrofit lets micro-turbines burn both hydrogen and natural gas"
"1het2r9","Shape-Shifting Antenna Takes Cue From ""The Expanse"" Inspired by the sci-fi show, the device morphs to suit its signals"
"1het4ww","Magnetic ""metasheet"" material moves objects like a conveyor belt"
"1hez16g","Researchers have developed a new device which will enable small drones to shoot powerful lasers – something once thought impossible"
"1hfj8vj","Optical fibers monitor brain for deadly post-injury complications"
"1hfk2a2","Physicists uncover new state of matter called quantum spin liquid | This discovery could open doors for further discoveries in fundamental and quantum physics."
"1hg83wx","""Crazy Li"" arms drones with powerful lasers that can cut through metal"
"1hgancg","Nuclear-electric rocket propulsion could cut Mars round-trips down to a few months"
"1hh0628","An innovative fertility technology using stem cells to help an embryo mature outside the body has resulted in the world’s first live human birth | Gameto, the company that developed the approach, says it’s faster, safer and more accessible than conventional IVF."
"1hh1izr","Cyborg cockroach armies can now be mass-produced at a rate of one every 68 seconds"
"1hhr8q6","Squid-based biodegradable sponge removes 99.9% of microplastics from water | The new sponge method is promising, but challenges such as properly disposing of absorbed microplastics remain a critical issue."
"1hhyvda","Biologically inspired bioactive hydrogels for scarless corneal repair"
"1hiiaj3","Billion times faster chip-based laser neuron can process 34.7 million images per second | The researchers have created chip-based quantum-dot laser-graded neurons."
"1hiicdb","Miniature VR headset to immerse mice in virtual environments to reveal neural activity | The researchers are looking to further develop the goggles, with a lightweight, mobile version for larger rodents."
"1hikehr","Chiral flat-band optical cavity with atomically thin mirrors"
"1hioquf","New physics sim trains robots 430,000 times faster than reality | ""Genesis"" can compress training times from decades into hours using 3D worlds conjured from text."
"1hj9sa6","A football field in a teaspoon: New material has insane surface area"
"1hjkbj3","CERN's Large Hadron Collider finds the heaviest antimatter particle yet | Hyperhelium-4 now has an antimatter counterpart"
"1hjyjq9","'Absolute miracle' breakthrough provides recipe for zero-carbon cement"
"1hjzcjn","Green sea turtle gets relief from “bubble butt” syndrome thanks to 3D printing"
"1hk6ua5","Tetsuwan Scientific is making robotic AI scientists that can run experiments on their own"
"1hkm4wo","Desert ant vision powers sci-fi style super chip to spot cancer, boost security | Chinese researchers have developed a miniature, on-chip polarization photodetector."
"1hkm88w","Scientists develop matchbox-sized laser in a bid to boost quantum research | The affordable, lightweight 780nm laser can perform on par with typical tabletop lasers and can be used both inside and outside the lab, according to the researchers."
"1hkmh5n","Engineers achieve quantum teleportation over active internet cables | As research advances, we could enter a new era in communication technology, where quantum and traditional networks can coexist to offer unprecedented levels of security and speed."
"1hkn6tk","Transparent bamboo: A fireproof and waterproof alternative to glass"
"1hlddah","Iron Man-inspired exoskeleton helps paraplegics walk again"
"1hldpy7","Will Even the Most Advanced Subs Have Nowhere to Hide? The scramble to preserve submarine stealth in an age of AI and all-seeing sensors"
"1hm0ife","MIT's light-activated antiferromagnetic memory could replace today's ferromagnets"
"1hm13re","A Bionic Leg Controlled by the Brain. A new kind of prosthetic limb depends on carbon fibre and computer chips—and the reëngineering of muscles, tendons, and bone."
"1hmd9zy","F1 stalwart is quietly innovating to bring its expertise in cooling to data centers and beyond | Castrol is developing dielectric fluids for immersion cooling systems "
"1hmm40v","The British Army is trialing radio waves to zap drones out of the sky – at 13 cents per shot | The system disrupt drones from over a kilometer away, essentially shooting them down"
"1hmnkkb","Twisted light: The Edison bulb has purpose again"
"1hms3kr","Swarms of tiny robots coordinate to achieve ant-like feats of strength"
"1hndqih","Stem cells from mice have been 'instructed' to form specific tissues and organs | Researchers can guide and control the development of stem cells into specific tissues and organs, opening the door to developing a means of one day tackling complex diseases like diabetes and Parkinson’s disease."
"1hne7v5","Breakthrough treatment flips cancer cells back into normal cells"
"1hod1vv","MIT engineers grow “high-rise” 3D chips. An electronic stacking technique could exponentially increase the number of transistors on chips, enabling more efficient AI hardware."
"1howzkh","Scientists Built Tiny VR Goggles for Mice"
"1hozms8","Five breakthroughs that make OpenAI’s o3 a turning point for AI — and one big challenge"
"1hplzo7","MIT team decodes quantum geometry in kagome metal for the first time | We know a lot about electrons in terms of their energy, nature, and movement. However, their quantum geometry has remained a puzzle."
"1hpnbb9","How Hallucinatory A.I. Helps Science Dream Up Big Breakthroughs"
"1hpnhv8","Anti-aging treat: Dog drug could extend human lifespan, US scientists explore | The US-based company believes their research on canine longevity will also benefit humans."
"1hpwd6c","In a first, surgical robots learned tasks by watching videos | Robots have been trained to perform surgical tasks with the skill of human doctors, even learning to correct their own mistakes during surgeries."
"1hqe9k9","Remote-controlled gene therapy uses ultrasound to kill cancer"
"1hr385t","Manta rays inspire faster swimming robots and better water filters"
"1hrorwc","A colossal 18,000kg EV is autonomously loading gold at a Canadian mine, with a high-performance 540 kW electric drivetrain and a massive battery"
"1hrt4mj","Clever armadillo-inspired ""fabric"" gets stiff or soft as needed"
"1hrtc3n","System to auto-detect new variants will inform better response to future infectious disease outbreaks | Researchers found a new way to identify more infectious variants of viruses or bacteria that start spreading in humans - including the flu, COVID, whooping cough and tuberculosis."
"1hsl46v","New ultrasound tech could be used to 3D-print implants inside the body | In order to keep surgeries minimally invasive, it would be great if implants could be injected into the body in liquid form, then solidified once in place."
"1hsobi1","Scientists extract gold from e-waste to transform CO2 into valuable chemicals | The team’s innovation recovers gold from discarded electronics and uses it as a catalyst to transform CO2 into useful organic materials."
"1ht66c2","Injected hydrogel becomes a bone-healing solid when exposed to light | Cells from the adjacent bone tissue gradually migrate into such a material, where they proceed to reproduce as the material harmlessly biodegrades."
"1hte730","Implants made of your blood could repair broken bone"
"1htwmfg","Next-gen EV batteries could last decades, researchers show the potential of single-crystal electrode tech | The battery lifespan could be around 20,000 cycles or 8 million kilometers"
"1hu7mov","Liquid crystal glasses filter out epileptic-seizure-triggering light"
"1huh4zy","Robots can now walk through muddy and slippery terrain, thanks to moose-like feet"
"1huyvel","Parkinson's disease may one day be treated with a shot of magnetic discs"
"1hvg2gc","Drones With Legs Can Walk, Hop, and Jump Into the Air"
"1hvrnth","Clever coating for medical devices stops clots by imitating a blood vessel"
"1hwijft","Damaged coral reefs are getting a helping robotic hand | Various groups are now growing baby corals for transplantation into the world's disappearing reefs, but they need a hand. A new robotic hand has been created to help, by carefully transferring the li'l corals between tanks as they grow up."
"1hwik5t","Electrochemical reactor grabs 97.5% of lithium from geothermal sources | Lithium-ion batteries power everything from our vape pens to electric cars, but they have one glaring issue: they rely on lots of hard-to-harvest lithium."
"1hwkkof","A dash of gallium may make for stabler hip and knee implants"
"1hxbyeb","Australian scientists engineer ‘toxic male’ mosquitoes to combat deadly diseases | Male mosquitoes are being genetically modified to produce spider and sea anemone venom."
"1hxc1se","Scientists develop coldest-ever fridge for quantum computers for icy upgrades | This development increases the probability of a qubit being in its ground state before computation from 99.8-99.92% to 99.97%."
"1hxdbm7","Genetic tweak weaponizes mosquito semen for population control"
"1hy2kav","Prostate cancer is usually treated with surgery and radiation therapy, but these can have drastic side effects | A new clinical trial is exploring the safety and efficacy of killing the cancer cells with a blast of steam."
"1hy4uyv","'Thermochromorph' art changes with the temperature"
"1hyvoqs","Grain-sized soft robot delivers multiple medications, guided by magnetic fields"
"1hzcbqa","Smart stitches generate electricity on movement for faster healing | Scientists in China have now turned that weakness into a strength, developing stitches that generate an electric charge when stretched and heal wounds faster. "
"1i0dc54","""Functional cure"" for diabetes restores insulin production with stem cells | A patient with type 1 diabetes has been functionally cured of the disease. The treatment involves growing and transplanting new insulin-producing cells from the patient’s own stem cells."
"1i0dty2","New filter captures and recycles aluminum from manufacturing waste"
"1i0x6yc","AI unveils strange chip designs, while discovering new functionalities"
"1i14jv5","Under-skin implant dispenses naloxone to prevent opioid overdose deaths | The iSOS (Implantable System for Opioid Safety) implant is being developed to automatically dispenses naloxone from within the body."
"1i16708","Robotic sea turtle could soon be swimming in an ocean near you"
"1i16cgi","Japan Debuts First General-Purpose Quantum Computer Made of Light"
"1i18b5h","Donut Lab's New Motor Brings Power to the Wheel Hub | The Finland-based company's in-wheel motor serves up 650 kilowatts of power"
"1i19pvc","Scientists invent sand-powered seismic device to reduce earthquake damage by 75% | University of Sharjah professors patent an earthquake dissipation device that only needs sand to withstand seismic forces."
"1i1utnt","We've never been closer to accurately assessing whether an individual is more susceptible to developing major depressive disorder due to their biology, with 293 newly identified gene variants found to play a role in ramping up the risk factor | That's 42% more than was previously known."
"1i1xkwd","World's first liquid hydrogen powered turbine engine"
"1i2nfov","MIT’s robot bees break pollination records with 1,000-second hover, flips and more | The robot reaches 35 cm/s, performs flips, and traces paths like “M-I-T,” highlighting control and endurance advances."
"1i2pf46","Woven City is a real-world test bed for tomorrow's tech"
"1i2s4zm","Device Uses Wind to Create Ammonia Out of Thin Air | The process requires no external power to produce the green energy fuel"
"1i3eoao","Brain-Controlled Bionic Hand Offers Most Advanced Artificial Touch Yet | The new brain-computer interface device goes ""beyond anything that has been done before,"" the researchers claim."
"1i3f8ce","21st-century chainmail uses molecular instead of metallic links | The ""highest density of mechanical bonds ever achieved,"" researchers created a flexible material that works like chainmail. The breakthrough has already demonstrated its ability to improve body armor."
"1i3synh","Robots the size of rice grains aim to revolutionize brain surgery | Far less invasive than traditional tools"
"1i47blt","Heart attack damage could be reversed by reactivating dormant gene"
