"id","content"
"1fabf6p","MIT’s new silk-cellulose water filter blocks stubborn forever chemicals, metals | The new silk-cellulose filter outperforms traditional materials in removing contaminants, with strong antimicrobial properties that prevent fouling."
"1facruk","Low-cost EPR sensor on chip to boost quality control of food products"
"1faenle","Shapeshifting aircraft could be possible with new alloy that stretches 20 times | Shape-shifting aircraft have remained a part of science-fiction for decades, not any more."
"1fb4usb","US nuclear reactor breakthrough unravels plutonium oxide’s secrets at 3000 K | The research team employed an innovative method by suspending small samples of PuO2 in a gas stream and then heating them with a laser."
"1fbw0s6","'Modular' approach can help connect, control millions of qubits"
"1fcmmnx","China-US team creates plant-based nanoparticles to fight deadliest brain cancer | These nanoparticles are designed to penetrate the blood-brain barrier and target tumor cells directly."
"1fcn9ma","New muscle-powered robot leg promises more speed, energy savings"
"1fcpa68","Doctors have successfully operated on a pig – from 5,780 miles away | Using a video game controller, surgeons in Switzerland successfully performed an endoscopy on a pig in Hong Kong, paving the way for remote procedures in humans in areas where local expertise isn’t available."
"1fd7dfi","Newly Discovered Antibody Protects Against All COVID-19 Variants"
"1fde42d","First-ever 3D metal printing in space achieved on ISS | Built with Airbus, the Metal 3D Printer completed the first of four test shapes."
"1fde58y","Japan starts removing melted nuclear fuel 13 years after Fukushima disaster  | Advanced robotic technology, including a fishing rod-like arm, is being used to extract hazardous material from Fukushima’s reactors amid high radiation levels."
"1fdfytm","Princeton researchers bend DNA strands with light to probe the genome"
"1fdh122","New filtration material could remove long-lasting chemicals from water Membranes based on natural silk and cellulose can remove many contaminants, including “forever chemicals” and heavy metals."
"1fdj8bd","Wireless system WaveCore penetrates concrete walls without drilling | The system achieved a 4 Gbps connection through a 12-inch concrete wall"
"1fe638g","Why you should always be wary of insider threats: A disgruntled employee at a US industrial firm deleted backups and locked IT admins out of workstations in a failed data extortion attempt"
"1fe85uv","Polaris’ new MIRA prototype to fly with world’s 1st aerospike engine"
"1fe9ln0","World’s strongest battery could extend EV range by 70%, make phones credit card-thin | The structural battery uses carbon fiber for its electrodes negating need for copper or aluminum, which add weight."
"1ff0cht","New sugar-based polymer could help remove heavy metals from water"
"1ff0lvt","Solar device makes 20L drinking water a day from seawater with 93% efficiency | The new device converts 93% of sunlight into usable energy, producing 20 liters of fresh water per square meter daily, significantly improving upon traditional desalination methods."
"1ffsme4","Nature-inspired 'Pyri' wildfire detector wins James Dyson Award"
"1ffvgbm","Tiny laser creates 180,000°F, 800 million times atmospheric pressure in cosmic simulation | In a series of precise measurements, the scientists varied the timing between the laser pulse and the X-rays passing through the target."
"1fgkm47","Fluorescent nanomaterial to be used without lab, can transform forensics"
"1fhae9c","CO2 turned into fuel: Japan’s scientists convert captured carbon into green fuel | The new electrochemical cell converts bicarbonate (from captured carbon) into formate, a potent green fuel."
"1fhayyb","Breakthrough edge state in atoms could lead to infinite energy sources"
"1fi0gog","""Golden Lettuce"" genetically engineered to pack 30 times more vitamins"
"1fiwwnd","Engineers create powerful battery ‘fuel’ that stores energy even in low sun, wind | The team created a novel electrolyte, an acetamide and ε-caprolactam solvent, to aid in the battery’s energy storage and release."
"1fix1ev","Neuralink rival Synchron achieves 1st Alexa control via brain chip"
"1fj209n","Germany unveils solar roof tile that powers heat pumps as well as homes | Each solar roof tile can generate 44 W of output, meaning just fives tiles can generate 200 W of power."
"1fjizwz","NHS scientists find new blood group solving 50-year mystery"
"1fjnzjq","World-first ADHD headband treats symptoms in 20 minutes per day"
"1fjrdu4","Engineers create squid-inspired magnetic screen for encrypted displays "
"1fju3pm","Transparent solar cell technology could allow smartphones and cars to self-charge | Breakthrough in solar cell modularization paves way for commercial applications"
"1fkg9yi","World’s largest ethanol-to-jet fuel plant finalized, 250mn gallon yearly output | The 60-acre facility will revolutionize the global aviation industry by providing a scalable supply of low-carbon jet fuel."
"1fkjqih","Solar fuels soon? Researchers succeed in making ethylene from CO2"
"1fkk8x5","Indestructible 5D memory crystals to store humanity’s genome for billions of years | These crystals can store up to 360 terabytes of data for billions of years, resisting degradation even in extreme temperatures."
"1fkke4u","Hollow concrete mimics human bones for 5x better toughness | Engineers have developed a new kind of concrete that promises more than 5 times the damage resistance of the usual stuff, by poking holes in its structure."
"1fkmmcj","Scientists have demonstrated a new potential treatment for bone cancer | A bioactive glass laced with a toxic metal was able to kill up to 99% of the cancer without harming healthy cells, and could even help regrow healthy bone after."
"1fl82k8","Molten salt battery can replace lithium devices, works in heat without catching fire | The high-temperature battery uses molten salt as the electrolyte."
"1fl9xm6","Highly toxic gallium kills 'greedy' cancer cells with 99% accuracy, study says"
"1flae6f","Trash to tower: MIT engineers 3D-print LEGO-like glass bricks as tough as concrete | The researchers used soda-lime glass, commonly found in glassblowing studios, to produce prototype bricks."
"1flc1qq","World’s first antenna that turns glass windows into 5G towers unveiled in Japan | Wave Antenna has no external presence and helps improve 5G coverage in urban areas."
"1fm0m66","Defeating AIDS: MIT reveals new vaccination method that could kill HIV in just two shots |  MIT researchers found that the first dose primes the immune system, helping it generate a strong response to the second dose a week later."
"1fm1y0m","Nuclear fusion: ORNL's method to identify new alloys for reactors"
"1fmofe0","Researchers Store Entire Human Genome on ‘Everlasting’ 5D Memory Crystal "
"1fnf9ov","US to hit energy jackpot with 2,200 MW floating plant that will power 770,000 homes |  The total power capacity of approved projects is now over 15 GW, with more than 5 GW being installed and over 300 MW already working."
"1fninkc","New gold nanoparticles offer a better way to analyze kidney health"
"1fnj024","Red to rescue: Scientists turn CO2 into a powerful cancer-fighting compound | A new bacteria-based technology could help combat climate change while producing a valuable antioxidant."
"1fo7f6j","OpenAI CEO: We may have AI superintelligence in “a few thousand days”"
"1fo8krf","10,000-year-old DNA, oldest ever in South Africa, shows country’s genetic consistency | Researchers from South Africa just successfully sequenced the genomes of 13 individuals that lived 1,300-10,000 years ago."
"1fo9vxk","Stretchy Wearables Can Now Heal Themselves | Korean breakthrough material opens up new path to biosensors and stimulators"
"1fobs7x","New rebar-tying robot could speed up construction, ease worker strain"
"1foenle","HORSE kicks off production of powerful 1.2L hybrid engines for EVs"
"1fp01j6","""World-first"" indoor vertical farm to produce 4M pounds of berries a year"
"1fp0gdm","New nasal spray offers 99.99% protection against flu, pneumonia, COVID-19 | In treated mice, virus levels in the lungs dropped by more than 99.99%, with normal levels of inflammatory cells and cytokines observed, indicating effective protection against infection."
"1fp37aw","New fireproof fabric can defend EV batteries from 2,300°F flames"
"1fpsehd","World’s largest waste-to-hydrogen plant unveiled, 30,000 tons yearly output |  Hyundai Engineering aims to contribute to sustainability by transforming plastic waste into hydrogen, accelerating the transition to a hydrogen society."
"1fpt92t","Thermoelectric generator pulls energy from room temperature heat | Scientists in Japan have developed a new organic device that can harvest energy from heat. Unlike other thermoelectric generators, this one works at room temperature without a heat gradient."
"1fpup3q","Project Pele: US starts building unique 5MW mobile nuclear reactor"
"1fqkyk2","Scientists turn toothpaste into edible transistors for smart health tracking | Copper phthalocyanine, known for its teeth-whitening properties, can also be used as a semiconductor material."
"1fqlsrg","Breakthrough sun-powered tech pulls lithium from seawater, redefining energy | A membrane-free electrochemical cell separates lithium ions between brine and fresh water using iron-phosphate electrodes."
"1frdh69","ITER: First 5,200-ton vacuum vessel built to contain plasma for fusion"
"1frh98p","Meet LISA: The $1.6 Billion Space Telescope That Will Redefine Astronomy"
"1frrz4e","Robot hand can detach from arm, crawl over to objects, and pick them up"
"1fs2vw2","Samsung unveils world’s first ultra-small solid-state battery"
"1fssrie","Knit wit: 1st-ever cat cap that measures brain activity without sedation | In a first, veterinary scientists have successfully scanned the brains of cats in a conscious state."
"1fsui2r","UK explores world’s most powerful tidal turbine to unlock clean energy"
"1ftl54s","Hybrid energy raft could power 1,000 homes daily with wave, wind, solar | The power plant is a 38-meter raft with wind turbines and solar panels, generating about 1 MW with a 40% capacity factor."
"1ftl70b","Laser headband non-invasively IDs stroke risk in real time | Researchers have developed a wearable laser-based device that monitors brain blood flow changes and volume when a patient holds their breath."
"1ftn34s","Caltech's laser headset becomes 1st-ever device to predict stroke noninvasively"
"1fucu79","Tiny robot convoy conducts successful endoscopic surgery in a medical first | The robotic convoy’s surgical efficacy was demonstrated using pig organs."
"1fugro3","LG’s 100x thinner-than-hair material cuts battery explosion risk in EVs by 50% | SRL allows electricity to flow normally unless the battery gets too hot, in which case it acts like a fuse to stop it."
"1fv5dkt","Scientists have traced all 54.5 million connections in a fruit fly’s brain | By tracing every single connection between nerve cells in a single fruit fly’s brain, scientists have created the “connectome,” a tool that could help reveal how brains work."
"1fv6amw","World’s 1st solar-powered fuel delivery truck runs 8 hours on sunshine"
"1fvwoy9","MIT’s Star Wars-inspired ‘tractor beam’ uses light to capture, manipulate cells | This device could be used to study DNA, identify different types of cells, and explore the underlying causes of diseases."
"1fvxu2p","New polymer membrane boosts solid-state EV batteries' performance"
"1fvysc4","Stronger, greener PVC developed through chemical bonding to end microplastic menace | Researchers have found a way to electrically attach plasticizers directly to PVC molecules, creating a more stable and durable material through a process called “grafting.”"
"1fw1jbl","Scar-free healing: Worm protein could revolutionize wound treatment | Scientists found treated skin healed faster, even regenerating hair follicles by day 12."
"1fwp39i","US: New tool could help power 22 million homes with marine renewable energy"
"1fxfow6","Wine powers new battery tech, could boost EV range, performance"
"1fxjcd1","Pangolin-inspired robot poops tree seeds into holes it digs"
"1fy4w72","Wi-Fi Goes Long Range on New WiLo Standard | The new approach could underpin agricultural sensor networks and smart cities"
"1fy5b1l","New paper-based sensor detects heart attack biomarkers in just 15 minutes | Researchers have designed a paper-based vertical flow assay (VFA) to detect heart attack biomarkers."
"1fy5dp0","BrainChip unveils microscopic NPU that consumes less than 1 milliwatt of power | Designed for wearables, smart home, and IoT applications"
"1fy6aew","New metal-eating ‘bullet’ thrusters could power spacecraft for near-infinite range"
"1fyy13r","World’s 1st donor cell therapy helps 3 autoimmune disorder patients"
"1fyzxqs","Mussel-inspired sticky bacteria breaks down tough plastic waste faster | Annually, the U.S. generates as much as 40 million tons of plastic waste."
"1fz9bu0","Four-legged robot learns to climb ladders"
"1fzpk1n","Scientists create 1st light-powered microrobot to swim through sticky mucus | The first light-driven, toroidal micro-robot capable of autonomous movement in viscous liquids has been designed."
"1fzpohr","Electrical Stitches Speed Wound Healing in Rats | New sutures generate static electricity to mimic the body's natural electrical signals"
"1g02v71","NASA opened a $3M challenge for waste management in space!"
"1g0f66q","Robotic ‘finger’ could perform your next intimate physical exam  | Researchers have developed an ultrasensitive, human-like robotic ‘finger’ capable of safely performing routine physical examinations like a medical doctor would. They say the ‘robodoctor’ could be seen in medical clinics soon."
"1g0h2nq","US scientists turn waste streams into jet fuel that reduces carbon emissions by up to 70% | Volatile fatty acids can play a critical role in decarbonizing the aviation industry."
"1g0hb3o","New octopus-inspired adhesive’s gripping power holds anything underwater | This new technology has potential applications in underwater salvage, and rescue operations."
"1g0i9wn","Lasers could take broadband where fiber optics can’t"
"1g0mqy3","South Korea unveils world’s 1st autonomous, amphibious robotic missile launcher"
"1g172r9","Spider-Man-inspired sticky silk fibers lift 80 times their weight | The first web-slinging technology in which a fluid material shot from a needle solidifies – and is strong enough to adhere to and pick up objects."
"1g19dkw","Stretchable solar cells retain 95% efficiency after 100 stretches"
"1g1bnrq","US scientists shatter high-power uranium beam record, unlock new isotopes | A uranium beam striking a target undergoes fragmentation or fission, producing a range of rare, unstable isotopes with different numbers of neutrons."
"1g1zh1q","Soft robotics: how vine-like robots are transforming tumor treatment"
"1g2nc19","Two people communicate in dreams: Inception movie-styled sci-fi turned into reality | Participants were sleeping at their homes when their brain waves and other polysomnographic data were tracked remotely by a specially developed apparatus"
"1g2yjyd","Researchers develop method to make sound waves travel in one direction only | The research has applications in various fields, including radar technology and signal routing"
"1g3f1bu","Sodium batteries' commercialization gets boost with this novel method"
"1g435dl","Cardiovascular breakthrough: Nanoparticle therapy cuts plaque buildup in arteries | The new therapy works by identifying and attacking the specific areas of inflammation in the arteries."
"1g45iiz","'ZeroCAL' cement production process takes CO2 out of the equation | With 98% less CO2 emissions than traditional methods by decomposing limestone – the key raw material involved in making cement – to access calcium oxide, aka lime, without releasing carbon dioxide in the process."
"1g45kfu","World’s first 100% silicon anode EV battery unveiled, charges in 8.5 minutes | ProLogium’s 100 percent silicon composite anode enhances energy density and fast-charging performance."
"1g46xxx","New nanoparticle breakthrough targets fat absorption to combat obesity"
"1g4wnpa","Breakthrough eye scanner can detect diabetes, heart disease, Alzheimer’s | Eyes can be windows to our overall health."
"1g4xbgk","Florida hospital deploys $860K air-to-water generator in wake of Hurricane Milton | Proves that air moisture capture can supplement emergency water supply"
"1g4xxk3","Western Digital launches 32TB hard drive in SATA and SAS flavors, which is a new record for shingled magnetic recording-based drives — Ultrastar DC HC690 delivers sequential performance up to 257 MiB/s"
"1g4yped","ProLogium unveils 100% silicon composite anode EV battery at Paris Motor Show"
"1g51mop","First-ever human skin atlas provides ‘molecular recipe’ to build skin, heal scars | Through this organoid, the researchers were able to study how immune cells, specifically macrophages, contribute to blood vessel formation."
"1g5f5c0","938 Gbps: 6G testing hits 9000x 5G speed, could download 20+ movies in a second | The researchers achieved a 938 Gbps transmission data rate with less than a 300 MHz gap between different RF and mm-wave bands."
"1g5qb0l","US Space Force backs nuclear microreactor-powered rocket breakthrough"
"1g5qpzp","This Eyewear Offers a Buckshot Method to Monitor Health | Emteq Labs' Sense glasses track food and facial expressions"
"1g6hszs","Write with heat, erase with light: New tech could revolutionize data storage"
"1g7833g","From fingertip to insight: tracking health with sweat-powered sensors"
"1g7bqas","China’s Chery unveils autonomous flying car, completes 50-mile test flight |  The flying car, named ‘Land and Air Vehicle’, is designed without a steering wheel and comes with full autonomous driving capabilities"
"1g8lt7a","Handheld diagnostic that can isolate biomarkers for different diseases using sound waves, from a single drop of blood, in around an hour."
"1g8maxi","US’ laser facility to advance fusion research to achieve limitless energy | Beyond fusion and basic science research, the ATLAS Facility will also support interdisciplinary work into topics like medicine."
"1g8mbpw","China sets new world record with 800,000 times more magnetic field than Earth’s | China’s record-breaking magnet sets the stage for developing reliable magnets capable of sustaining even stronger magnetic fields."
"1g8o4up","World’s first hydrogen-powered wheel loader deployed in Austria"
"1g9gwmv","World’s largest alkaline electrolyzer will make 990 lbs of hydrogen per hour | According to Shuangliang, the new device can pump out around 396 pounds of hydrogen gas per hour."
"1g9hdn9","‘Electric plastic’ could open door to new generation of implants and wearable tech | Self-assembling, biocompatible molecular ribbons can store energy and information"
"1g9iljv","Scotland trials unique electric wallpapers to warm ‘oldest homes’ in world"
"1g9yb20","Anthropic’s latest AI update can use a computer on its own"
"1ga62zk","My dead father is writing me notes again"
"1ga7vkc","NYU develops new drug that attacks cancer cells without harming healthy ones | The researchers say the new technique may lead to new ways to treat patients with some cancers with minimal side effects."
"1ga81eq","Mercedes’ first EU plant to recycle 96% of batteries to power 50,000 new EVs yearly | The facility processes 2,500 tonnes of batteries yearly, supplying recycled materials for over 50,000 new EV battery modules."
"1ga9gjd","MIT engineers create solar-powered desalination system producing 5,000 liters of water daily | This could be a game-changer for inland communities where resources are scarce"
"1gaa894","Australia: World-1st tech achieves 90% lithium recovery from deserts"
"1gayuar","Rare Earth oxide coatings allow turbine engines to operate at record 3,300°F | The researchers created and tested new combinations of rare Earth elements, such as yttrium, erbium, and ytterbium."
"1gb1mgk","10 floors tall: China unveils world's most powerful hydraulic cylinder"
"1gb41fk","50 mins of no oxygen: Liver helps revive dead pig’s brain after heart attack | The key to the experiment’s success lies in incorporating the liver into a life support system known as liver-assisted brain normothermic machine perfusion."
"1gbqg92","Popular drug to end early pregnancies could also extend lifespan, scientists say | Scientists say mifepristone, used in cancer and reproductive care, could pave the way for anti-aging treatments."
"1gbtnkj","Oxford creates world’s smallest biodegradable battery for medical use"
"1gd8ytf","US develops portable device that extracts water from air using 50% less energy | The device uses special materials that change temperature when stretched or compressed, allowing it to cool the air and condense water vapor with minimal energy use."
"1gdahxn","High-performance computing software scans a mega quantum detector"
"1gdl9zp","Capturing carbon from the air just got easier"
"1gdzobv","Gold extraction from e-waste gets 10 times more efficient with new sponge material | Researchers developed a nanoscale cross-dimensional composite material via self-assembly of two-dimensional graphene oxide and one-dimensional chitosan macromolecules."
"1geiha6","MIT’s new cancer therapy combines tumor destruction, chemo in single implant | The combination of phototherapy and chemotherapy could offer a more effective way to fight aggressive tumors."
"1getptm","3D laser bioprinter designed for precise human tissue engineering"
"1gfkn0p","Scientists find CO2-eating algae strain, could help in ocean decarbonization | This strain sinks easily in water, making it an excellent candidate for carbon sequestration projects and the bioproduction of valuable commodities."
"1gflnk0","3.5 GW: World first artificial island can power 3 million homes"
"1gfobbs","Breakthrough light-harvesting photoswitch can store solar power for months | When heat is stored as chemical bonds, it can be retained for weeks and months without energy losses."
"1gfop1o","The world's first ever electric hydrofoil ferry begins operations"
"1ggbp4p","Waste polystyrene patch generates static electricity from wind, could run ACs | This energy harvesting is enabled by electrospinning alternating layers of small and large diameter polystyrene fibers."
"1ggdtlc","Rice physicists rewrite magnetism rules to boost quantum computers"
"1gghl7p","Powerful laser cuts 100mm steel underwater with ease for safer nuclear cleanup | Even in simulated underwater conditions at depths up to 10 meters, KIMM’s technology can use a powerful laser to cut through stainless steel"
"1gh2tbz","Power on the move: New silk thread tech turns clothes into electricity generators | This flexible, lightweight, and non-toxic material makes it ideal for wearable applications."
"1gh4jg6","New plant plans to recycle 30% of US' retired solar panels in 2030"
"1gh4wtp","Used tire-based solar desalination tech makes 3.67 liters of drinking water daily | The device generated 3.67 liters of fresh water each day during the test in Halifax Harbour."
"1ghvn9j","Space debris tracking improved by 10,000x with breakthrough laser tech"
"1gik7bn","US firm follows unique pulsed magnetic concept to achieve fusion for limitless energy | The company is using pulser modules, a small meter-scale fusion chamber, and centimeter-scale fuel containers for the critical process."
"1gik8cw","Breakthrough material could help replace lithium cells, lead to potassium batteries | Many of the highest-performing potassium-ion battery designs currently use cathodes made from Prussian White."
"1gimonz","Robot retrieves 1st melted fuel sample from damaged Fukushima reactor"
"1gjegsn","Bidirectional charging EV batteries could help EU save over $23 billion a year "
"1gjgxyg","World’s first immortal lip cells created in a groundbreaking lab study | Researchers from the University of Bern achieve a significant first step in lip research by producing immortalized lip cells in the lab."
"1gk4ika","World’s 1st cloned ferret gives birth to healthy kits in a conservation milestone | The introduction of genetic material from a cloned ferret aims to enhance genetic diversity and improve the species’ chances of survival."
"1gk69w7","90% in 15 mins: US firm’s new EV battery achieves higher charge with silicon anode | The EV battery is close to achieving 1,000 cycles and has also passed the military nail penetration test."
"1gk6jpc","New high-speed 3D bioprinter uses acoustics to print human tissues"
"1gkyspt","Silicon-based EV batteries promise 2x range, improved safety, and fast charging"
"1gl1g6t","Europe’s record-breaking hyperloop hits 88-mile milestone at blazing 303 mph | Tests hit a milestone, simulating an 88-mile hyperloop journey on a 7.3-mile track, reaching 303.4 mph, scaled to 25.3 mph in low-pressure tests."
"1glp5jj","From trash to fuel: US scientist unlocks green hydrogen potential in plastic bottles | The research uses low-amount solvents acting as hydrogen sources to break down a specific class of plastics called condensation polymers."
"1glq2sw","Norwegian researchers develop energy-efficient CO2 capture reactor"
"1gltvxj","Advanced sensing tech can detect lung cancer in your exhaled breath"
"1gm7hna","Security experts warn of new hacker strategy targeting Windows drivers"
"1gmh026","Researchers develop low-cost system to detect wildfires within seconds of ignition | This system, called FireLoc, could detect fires igniting from up to 3,000 feet away and accurately map wildfires to within 180 feet of their origin."
"1gmhrb2","How nuclear power is shaping the future of commercial shipping"
